subreddit,meta,text
starwars,entertainment,died spins
starwars,entertainment,nt think necessarily knows connection luke though pretty sure interprets rey internalization isolation loneliness dreams probably assuming dreams even heard luke jedi actually exist
starwars,entertainment,times saw seemed meant island child true would mean luke nt hunting island already knew fine logic since may wanted keep secret wow maybe found
starwars,entertainment,tie fighters flying nice touch well done
starwars,entertainment,sure https youtubeqds6re3hgo
starwars,entertainment,awesome missing sick spins
starwars,entertainment,awesome really well made
starwars,entertainment,brains would nt slow roasted quite tender would suggest slow braise legs grind arms shoulder stormtrooperloaf make soup rest god write
starwars,entertainment,book aftermath pretty much confirmed one characters accounts endor
starwars,entertainment,ca nt look dead hatefilled eyes godless killing machines see soul monster yeah ate bodies made ornaments skulls
starwars,entertainment,one new comics bit rebel soldier asks kind meat eating celebration battle endor never see answer feel like comic writer knew
starwars,entertainment,wellorganized list bonus points kind infographic newcanon comics issues released storylines cut across etc
starwars,entertainment,darth vader 20 sounds awesome
starwars,entertainment,idea poe getting comic
